created_at,text
2010-06-25 18:16:44 +0000,"@LizSingZ4U oops, sorry about that! thanks for the support!"
2010-06-25 18:11:44 +0000,"Thanks for the #FF @Kentrod, @lizdingz4u, @allenjwilson, @chucksrant, @dminor85! We appreciate the support."
2010-06-25 16:44:23 +0000,"Good Morning Everyone! This post from @redstate http://bit.ly/b8e1Mp about ""Wal Mart Moms"" is fascinating. Worth a read!"
2010-06-25 01:29:35 +0000,Tune in to KOGO now to hear Carly! http://www.kogo.com/main.html
2010-06-24 21:05:39 +0000,Read CBS' account of the jobs tour in SF today: http://bit.ly/csCsEd
2010-06-24 18:13:52 +0000,@izzysroses not yet. A judge released a little more but it's still only 45% of normal
2010-06-24 18:12:03 +0000,Curious about our jobs tour? Check out this video from our Fresno stop! http://bit.ly/dyBQeW
2010-06-24 17:28:29 +0000,Talking about job losses in San Francisco http://twitpic.com/1zku59
2010-06-24 15:16:09 +0000,We are getting ready for the jobs tour stop in San Francisco this morning- Stop number 5 and going strong!
2010-06-23 23:01:42 +0000,Barbara Boxer's plan for jobs and the economy? Overpromise and underdeliver. http://bit.ly/abaLeE
2010-06-23 19:12:28 +0000,Also interesting... Gallup poll shows Dem enthusiasm is low and Rep enthusiasm is high for 2010 midterms! http://bit.ly/avrjqf
2010-06-23 19:05:25 +0000,"""Wal Mart Moms"" were a key swing vote for Obama in 08... seems they're leaning Rep in 2010:  http://bit.ly/9YtvHE"
2010-06-23 18:37:45 +0000,Become a fan of Boxer Bites today to learn about the many ways Barbara Boxer has failed CA! http://bit.ly/dCeQ9l
2010-06-23 17:04:55 +0000,Chatting about opportunities for recent college grads and the job market http://twitpic.com/1zamrp
2010-06-23 16:47:15 +0000,Discussing jobs with women in LA http://twitpic.com/1zai1l
2010-06-23 16:45:04 +0000,All ready for our women's roundtable! http://twitpic.com/1zaheo
2010-06-23 16:19:21 +0000,Unemployment in LA County http://twitpic.com/1zabdo
2010-06-21 20:07:25 +0000,http://bit.ly/9iY5QH Boxer showing rare vulnerability for a California dem... Read more (via @redstate)
2010-06-21 19:08:54 +0000,"http://www.sacbee.com/2009/03/19/1698037/unemployment-in-california.html
 Check out this graph of unemployment in CA"
2010-06-20 22:43:15 +0000,A Father's Day message from Carly: http://carlyforca.com/2010/06/a-fathers-day-message/
2010-06-19 21:45:37 +0000,http://twitpic.com/1y8lxu
2010-06-19 21:20:48 +0000,Addressing the crowd at Juneteenth http://twitpic.com/1y8ev5
2010-06-19 20:39:24 +0000,Enjoying the Juneteenth Festival in Los Angeles http://twitpic.com/1y8370
2010-06-19 16:09:59 +0000,We are heading to Los Angeles for the Juneteenth celebration. Beautiful CA day!
2010-06-18 22:16:53 +0000,Tune in to http://www.rogerhedgecock.com/Default.asp?cchk=yes at 3:20 to hear Carly live with Roger Hedgecock!
2010-06-18 21:27:51 +0000,@kentrod Thanks Ken!
2010-06-18 19:07:30 +0000,Carly will be on Your World with Neil Cavuto at 1:40pm Pacific on Fox News. Tune in!!!
2010-06-18 16:12:24 +0000,Talk to your senator…for a price! http://bit.ly/d5VESe
2010-06-18 15:22:07 +0000,Tune in to KOGO at 8:20 to hear Carly live with Chip Franklin http://www.kogo.com/main.html
2010-06-17 17:33:10 +0000,Carly discussing the need for more private sector jobs http://twitpic.com/1xl73d
2010-06-17 16:52:21 +0000,Unemployment in Sacramento. The jobs tour continues! http://twitpic.com/1xkwo2
2010-06-17 15:50:12 +0000,Continuing our statewide jobs tour in Sacramento this morning!
2010-06-16 23:08:49 +0000,@rolandpinto Thanks for serving!
2010-06-16 22:30:38 +0000,Yet another poll showing Carly with a lead over Barbara Boxer! http://www.ccadvertising.com/survey2010/june/ca/index.html
2010-06-16 20:50:10 +0000,http://bit.ly/9hi1qX Listen to veteran Chuck McDougald discuss Barbara Boxer's record on KOGO this morning
2010-06-16 20:45:35 +0000,@rolandpinto thanks for the support!
2010-06-16 20:23:55 +0000,"Missed the ""Call me Senator"" postcards this morning? Here's the link again-- send today! http://bit.ly/9hrs2I"
2010-06-16 14:25:38 +0000,"Today is the anniversary of Boxer's infamous ""call me Senator"" exchange! Commemorate it w/ an anniversary postcard! http://bit.ly/9hrs2I"
2010-06-15 20:34:40 +0000,How has Barbara Boxer failed the people of the Central Valley? Let me count the ways: http://bit.ly/cvK6cO
2010-06-15 17:43:48 +0000,Carly addressing the stimulus and unemployment in Fresno  http://twitpic.com/1x1hrw
2010-06-15 17:32:19 +0000,Mendota City Councilman Leo Capuchino discussing his city's devastating unemployment.  http://twitpic.com/1x1ekd
2010-06-15 16:27:29 +0000,Stop #2 on our statewide jobs tour. Fresno! http://twitpic.com/1x0wzn
2010-06-14 18:57:20 +0000,http://bit.ly/dyloUG New Pajamas Media poll-- Carly leads Barbara Boxer!
2010-06-14 18:19:51 +0000,Check out Carly's appearance on Meet the Press yesterday! http://www.youtube.com/watch?v=7054njbF37E
2010-06-13 14:04:28 +0000,"Obama skipped oil spill memorial service to fundraise for Boxer. (Boxer claimed spill was ""top priority"" days before.) http://bit.ly/cvYJ1M"
2010-06-13 13:15:48 +0000,Tune in to Meet the Press at 6:30 to watch Carly!
2010-06-11 18:54:38 +0000,"Seen the new FailedSenator.com, a blog about Barbara Boxer's failures? Today's post asks, ""Where are the jobs?"" http://bit.ly/cEkE1E"
2010-06-11 17:56:26 +0000,Unemployment in San Diego http://twitpic.com/1vvot0
2010-06-11 17:54:15 +0000,Lost jobs in San Diego http://twitpic.com/1vvo6m
2010-06-11 17:19:00 +0000,Launching statewide jobs tour in San Diego http://twitpic.com/1vvegb
2010-06-11 15:03:25 +0000,"On our way to San Diego to kick off our statewide jobs tour. Barbara Boxer, where are the jobs you promised?"
2010-06-10 22:04:23 +0000,San Diego Union Tribune: Race must focus on jobs. http://www.signonsandiego.com/news/2010/jun/10/boxer-vs-fiorina/
2010-06-10 21:39:36 +0000,http://www.youtube.com/watch?v=845UnoB5nxQ Check out Carly's speech at the GOP Victory Rally yesterday!
2010-06-10 17:19:14 +0000,Tune in to Dennis Prager now to hear Carly!
2010-06-10 16:12:29 +0000,"Larry Kudlow: Carly Fiorina, woman for the future http://bit.ly/cezqxh"
2010-06-09 20:01:54 +0000,Diane and Carly http://twitpic.com/1vcfls
2010-06-09 19:48:39 +0000,Carly interviewing with Diane Sawyer http://twitpic.com/1vccjm
2010-06-09 18:31:42 +0000,"http://bit.ly/aUKjwP Dear @boxer_2010, we will debate you any time, any where. Early and often. #casen"
2010-06-09 18:27:37 +0000,Do you have a story about Barbara Boxer failing you? Tell it here: http://www.failedsenator.com/story/ #MeetMeInMendota #casen #fail
2010-06-09 17:47:32 +0000,Thanks to @TalktoTom and @chuckdevore for their gracious endorsements and support. Together we can fire Barbara Boxer.
2010-06-09 17:46:19 +0000,"Carly: Barbara Boxer, bring it on. Any time, any place. Meet me in Mendota. See the destruction of govnmt over reach."
2010-06-09 17:36:37 +0000,The 2009 Republican ticket! http://twitpic.com/1vbh8o
2010-06-09 17:12:07 +0000,Packed victory rally! http://twitpic.com/1vbbn3
2010-06-09 16:09:49 +0000,On our way to the Repulican unity event!
2010-06-09 05:32:14 +0000,Carly addressing the cheering crowd. http://twitpic.com/1v781o
2010-06-09 05:07:46 +0000,Carly: It is time to hold Barbara Boxer accountable for her 28 failed years in Washington.
2010-06-09 04:27:17 +0000,Barbara Boxer is more vulnerable than ever. Get your Carly gear now to stand with Carly! http://bit.ly/c2vliq
2010-06-09 04:08:18 +0000,AP calls it for Carly!!!!!!
2010-06-09 02:31:31 +0000,@gotubsgo thanks! We love it.
2010-06-09 00:15:14 +0000,3 hours until the polls close! Get out there and vote if you haven't already!
2010-06-08 23:25:51 +0000,Greeting supporters http://twitpic.com/1v4mtj
2010-06-08 23:25:00 +0000,Media avail. Go vote!  http://twitpic.com/1v4mil
2010-06-08 23:21:10 +0000,Final push! #ivotedcarly http://twitpic.com/1v4lp4
2010-06-08 22:51:22 +0000,Tustin phone bank! http://twitpic.com/1v4f0a
2010-06-08 19:36:57 +0000,"Did you vote today? Tweet us photos of your ""I Voted"" sticker! #ivotedCarly"
2010-06-08 17:33:49 +0000,Voting!!! http://twitpic.com/1v2pkc
2010-06-08 12:21:20 +0000,Don't forget to vote today! Show your support for California's next U.S. Senator! #ivotedcarly #casen
2010-06-07 22:06:21 +0000,@TheJonMark LOVE THIS!
2010-06-07 21:08:50 +0000,We must take our government back. Make it listen. Make it work. http://twitpic.com/1uuvg0
2010-06-07 21:02:02 +0000,@rprez2012 Thanks for your support! Tell your friends and tweet away!
2010-06-07 20:56:12 +0000,"""What a refreshing change Carly will be!"" Councilman Faulconer announcing his endorsement. http://twitpic.com/1uusl3"
2010-06-07 20:52:52 +0000,Councilman DeMaio kicking off endorsement press conference in SD! http://twitpic.com/1uurtd
2010-06-07 20:39:34 +0000,"http://www.magellanstrategies.com/index.php/category/blog/ Magellan Strategies:  Fiorina has a 35 point lead over Tom Campbell, 54% to 19%."
2010-06-07 18:28:49 +0000,"Exclusive Eyewitness News/Survey USA poll
Fiorina 48%
Campbell 22%
DeVore 16%"
2010-06-07 18:04:50 +0000,Sen Cornyn: Carly is the strongest against Boxer http://www.youtube.com/user/CarlyforCalifornia#p/u/0/nnuO0bmYYY4
2010-06-07 17:09:22 +0000,Volunteers hard at work in Burbank! http://twitpic.com/1ut7wk
2010-06-07 15:42:10 +0000,Tune in to Mike Gallagher's show NOW to hear Carly! Listen live here: http://www.mikeonline.com/
2010-06-07 15:02:42 +0000,Tune in to KABC Radio in Los Angeles now to hear Carly or listen live here! http://www.kabc.com/
2010-06-06 23:10:31 +0000,Phone banking in Santa Barbara http://twitpic.com/1um97k
2010-06-06 22:04:49 +0000,Sac Bee: Fiorina confident on local visit: http://www.sacbee.com/2010/06/06/2801512/efopsej-opfsj-sjfop-sejfpo-sjeopjpefoj.html
2010-06-06 20:21:25 +0000,Carly greeting phone bankers in San Luis Obispo http://twitpic.com/1ukykk
2010-06-05 23:51:50 +0000,@checktothepower thanks for your support! Tell your friends!
2010-06-05 23:46:39 +0000,Check out how awesome @studentsforcarly are and watch them prepare to take on @boxer_2010 http://www.youtube.com/watch?v=ejN_ZC1vZ7I
2010-06-05 23:37:49 +0000,http://www.youtube.com/watch?v=1LgXZD8wGMM Hear from our volunteers and check out our phone bank today!
2010-06-05 16:52:56 +0000,The Field Poll confirms Carly is positioned for a primary victory! http://bit.ly/ck60L3
2010-06-05 16:45:34 +0000,Outdoor phone banking for Carly http://twitpic.com/1u73iz
2010-06-05 13:28:33 +0000,Gearing up for a big day of phone banking across California! Text JOIN to CARLY to help us out!
2010-06-04 19:59:28 +0000,Phone bankers in Palm Desert calling for Carly! http://twitpic.com/1twp2m
2010-06-04 18:55:15 +0000,@TheJonMark Thanks for your support! Love the new avatar!
2010-06-04 17:44:24 +0000,Boxer in trouble? http://www.youtube.com/user/CarlyforCalifornia#p/u/0/rNygtPYLOfs
2010-06-04 17:39:09 +0000,The momentum continues! Respected Fresno Radio Host Ray Appleton endorsed Carly! Listen here: http://bit.ly/bduZGs
2010-06-04 17:34:42 +0000,Carly addressing the press in San Diego http://twitpic.com/1tvmxa
2010-06-04 17:22:33 +0000,Carly phone banking with supporters in San Diego! 5 days until the election! http://twitpic.com/1tvjeq
2010-06-04 17:14:52 +0000,@Ryan_Mahoney Thanks for your support! Tell your friends and have fun phone banking!
2010-06-04 17:04:10 +0000,San Diego phone bankers getting ready for Carly! http://twitpic.com/1tve0y
2010-06-04 15:00:15 +0000,Tune in to KCBQ now to hear Carly on Mark Larson's show! http://www.kcbq.com/
2010-06-03 21:17:14 +0000,Carly chatting with KUSI's Ross Becker http://twitpic.com/1tmw40
2010-06-03 16:38:53 +0000,Carly's piece in the Flashreport this AM: TAKING WASHINGTON BACK STARTS WITH BEATING BOXER  http://bit.ly/9ZK889
2010-06-03 15:04:03 +0000,Cap Weekly tracking poll shows Carly pulling away! http://bit.ly/c5BrdT
2010-06-02 20:07:07 +0000,"Tune in to KMJ at 1:30 if you're in Fresno to hear Carly on Ray Appleton's show! If not, listen live here: http://www.kmj580.com/pages/main"
2010-06-02 17:36:16 +0000,Carly launches new TV ad! http://www.youtube.com/watch?v=F3opch_q4M0 contrasting her record w/ Barbara Boxers on Nat'l Security #casen
2010-06-02 01:45:55 +0000,Campbell goes dark: http://latimesblogs.latimes.com/california-politics/2010/06/campbell-goes-dark-a-week-before-the-primary.html
2010-06-02 00:20:43 +0000,".@dickmorristweet endorses Carly! http://bit.ly/9PsDMq Says she is the ""best candidate to achieve victory for Reps in Nov over Sen Boxer."""
2010-06-01 16:56:33 +0000,http://www.youtube.com/user/CarlyforCalifornia#p/u/4/zF--Tl3PX3M Watch Carly talk about why she's running for U.S. Senate
2010-05-31 16:18:12 +0000,A Memorial Day message from Carly: http://carlyforca.com/
2010-05-31 14:21:27 +0000,A take on @TalktoTom by @aaronfpark http://bit.ly/bmDK8B
2010-05-30 18:29:47 +0000,http://bit.ly/cBDgeo Watch Carly challenge Boxer to meet her in Mendota to see what she has done to the ppl of the Central Valley #casen
2010-05-30 02:50:57 +0000,"Link to the poll: http://www.latimes.com/news/local/la-me-poll-20100530,0,1758814.story Go Carly!"
2010-05-30 01:19:05 +0000,Breaking: Carly's up 15 points in USC/LA Times poll!
2010-05-29 21:49:53 +0000,@californiaDCgrl thanks for your vote! Tell your friends!
2010-05-29 20:58:14 +0000,Carly endorsed by Fresno-area leaders http://twitpic.com/1s8old
2010-05-29 19:13:08 +0000,Sacramento phone bankers for Carly! Text JOIN to CARLY to help us phone bank http://twitpic.com/1s7vnl
2010-05-29 18:34:03 +0000,We've got a full house today in Clovis! http://twitpic.com/1s7kb3
2010-05-29 13:55:44 +0000,@MrsBrightside12 Thanks for the #FF!
2010-05-29 02:33:40 +0000,Great News! John of KFI's John and Ken just endorsed Carly!
2010-05-29 00:11:35 +0000,Tune in at 5:20 to hear Carly on @RogerHedgecock or listen live here: http://www.rogerhedgecock.com/
2010-05-28 19:25:31 +0000,@Smith_Caleb thanks for the #ff love and support!
2010-05-28 19:19:18 +0000,@PatrickinOH thanks for the #FF love!
2010-05-28 19:06:33 +0000,.@hoguenews endorses Carly! #casen. Thanks Eric Hogue!
2010-05-28 18:55:07 +0000,Tune in to KTKZ.com to listen live to hear Carly with @hoguenews for a full hour
2010-05-28 17:58:44 +0000,Carly about to go live on @news10_ca tune in at 11am at news10.net http://twitpic.com/1rvl0r
2010-05-28 17:23:17 +0000,@thenote we enjoyed the talk today! hope to chat with you again soon!
2010-05-28 16:09:13 +0000,Carly live on #topline w @thenote and @jonkarl http://twitpic.com/1ruoua
2010-05-28 15:50:29 +0000,We are about to go live on #thenote with @jonkarl
2010-05-27 23:46:22 +0000,Phone bank for Carly. Click here to find out how: http://carlyforca.com/2010/05/will-you-make-calls-for-carly/
2010-05-27 22:29:21 +0000,@thenote We're looking forward to tomorrow! Talk to you then! (Staff)
2010-05-27 20:35:15 +0000,Carly addressing supporters at the town hall event in Redding http://twitpic.com/1rm47f
2010-05-27 17:03:09 +0000,Redding followers- Carly will be in town for an 11am town hall at Former 84 Lumber Building-- 3625 Old 44 Drive. Join us if you can!
2010-05-27 03:56:08 +0000,Standing ovation for Carly! Great energy- we can and will beat Boxer!
2010-05-27 03:39:05 +0000,"Huge applause for Carly! ""I can and I will beat Boxer!!"""
2010-05-27 03:34:16 +0000,Carly addressing the Tea Party Patriots in El Dorado Hills http://twitpic.com/1rf7vg
2010-05-26 22:48:38 +0000,@isaachagerman Thanks for the support!
2010-05-26 22:34:03 +0000,Link to the full poll #casen http://bit.ly/b4H687
2010-05-26 22:33:34 +0000,"Breaking news! New poll! Magellan Strategies: Carly is surging with 44%, @TalktoTom has 21%, and @ChuckDeVore with 14%. http://bit.ly/9v819r"
2010-05-26 20:42:14 +0000,http://bit.ly/c5W6hh Per the PPP Carly does best against Boxer. #casen
2010-05-26 19:00:46 +0000,American for Tax Reform: Central Difference Between Carly Fiorina and @TalkoTom: Taxes http://bit.ly/a0LZRE
2010-05-26 16:22:05 +0000,"Dennis Prager just officially endorsed Carly saying, ""I have been particularly impressed by Carly and proud to endorse her."""
2010-05-26 16:19:43 +0000,Tune in to Dennis Prager http://www.dennisprager.com/pages/listen now to hear Carly! We hear there will be big news...
2010-05-26 15:49:23 +0000,"Meet Gayle Pacheco, California Coalition Chair for Carly for California -- and volunteer today: http://bit.ly/aelkdA"
2010-05-26 15:35:37 +0000,Tune in to KOGO in San Diego now to hear Carly! http://www.kogo.com
2010-05-26 15:28:27 +0000,CA Progress Report: http://www.californiaprogressreport.com/site/?q=node/7790 Even Boxer's donors realize she's in trouble!
2010-05-26 15:06:44 +0000,Good morning! Tune in to KGO Radio at 8:12 AM or listen live here http://www.kgoradio.com/ to hear Carly discuss the state of the race!
2010-05-26 00:11:03 +0000,Time to bounce Boxer!! http://twitpic.com/1r2gxh
2010-05-25 23:42:54 +0000,The site of Obama's rescue mission. Boxer is vulnerable. Clearly. http://twitpic.com/1r28c0
2010-05-25 23:35:58 +0000,Students for Carly!! http://twitpic.com/1r26aa
2010-05-25 23:03:23 +0000,Stop the Hot Air!! Time for a new Senator from CA!!! http://twitpic.com/1r1wtp
2010-05-25 22:36:14 +0000,The Boxer Blimp takes flight!!! http://twitpic.com/1r1p86
2010-05-25 21:58:29 +0000,Debate Fact Check #6: Taxin' Tom: http://carlyforca.com/2010/05/candidate-forum-fact-check-6-taxin%E2%80%99-tom/
2010-05-25 21:58:15 +0000,Carly: We must send someone to DC who knows how to create jobs and has real world experience
2010-05-25 21:57:25 +0000,Debate Fact Check #5: http://carlyforca.com/2010/05/candidate-forum-fact-check-5-beating-boxer/
2010-05-25 21:55:23 +0000,Carly: Tom has claimed he can win in the US Senate race... he's lost statewide office 3 times.
2010-05-25 21:54:16 +0000,Campaign Fact Check #4: http://carlyforca.com/2010/05/candidate-forum-fact-check-4-chuck-devore%E2%80%99s-flip-flop-on-taxes/
2010-05-25 21:53:06 +0000,.@TalktoTom thinks he's ahead in the polls... no. Just no.
2010-05-25 21:51:34 +0000,http://www.nbclosangeles.com/station/shows/NewsConference___Jan__25__2008_-_Seg__2_Los_Angeles.html video of DeVore on taxes
2010-05-25 21:50:58 +0000,DeVore: Exactly. A sales tax hike would be the cleanest way to go
2010-05-25 21:45:39 +0000,"FACT:
While Chief Republican Whip, Chuck DeVore acknowledged that he, along with his fellow Republican leaders, had put taxes on the table"
2010-05-25 21:43:34 +0000,Debate Fact Check #3: http://carlyforca.com/2010/05/candidate-forum-fact-check-3-2005-budget/
2010-05-25 21:43:11 +0000,Carly: It must be frustrating for Chuck DeVore to have so many conservatives endorsing me. Maybe it makes him feel better to belittle others
2010-05-25 21:41:43 +0000,Carly: Let's correct Chuck's misrepresentations once again. Prop 26 had broad bipartisan support incl most of the business community
2010-05-25 21:40:38 +0000,Chuck & Tom may be different but they're 05 budget buddies. I guess opposites really do attract (cue video) http://bit.ly/N4ahB
2010-05-25 21:39:57 +0000,Carly: I am the only candidate in this race who has been in the real world. @ChuckDeVore voted for the 05 budget created by @TalktoTom
2010-05-25 21:30:01 +0000,"Carly: ...I could say it's taxing my patience, but I don't want to give @talktotom any ideas"
2010-05-25 21:28:07 +0000,Debate Fact Check #2: Bank Bailouts: http://carlyforca.com/2010/05/candidate-forum-fact-check-2-bank-bailouts/
2010-05-25 21:27:29 +0000,Carly: Tom Campbell and Chuck DeVore have been misrepresenting me for many months.
2010-05-25 21:23:59 +0000,@GOPRevolution thanks for the support! Keep it up!
2010-05-25 21:16:39 +0000,Debate Fact Check #1: Immigration. http://carlyforca.com/2010/05/candidate-forum-fact-check-1-immigration/
2010-05-25 21:11:29 +0000,@gotubsgo thanks for the support! Please keep tweeting!
2010-05-25 21:11:18 +0000,Carly: I am the only candidate who can defeat Boxer. We must demand the government do its job.
2010-05-25 21:10:50 +0000,Carly: We must demand that the federal government secures the border.
2010-05-25 21:07:41 +0000,Carly got the biggest cheers during the introductions-- Go Carly!
2010-05-25 21:03:57 +0000,@PaulyCicero Thanks for the support!
2010-05-25 21:03:37 +0000,@PatrickReagan Thanks for the support! Keep tweeting!
2010-05-25 21:01:20 +0000,Here we go! Time for Carly to show she is the only conservative in this race who can beat Barbara Boxer
2010-05-25 20:35:36 +0000,We'll be live tweeting the discussion with John and Ken at 2pm. If lots of tweets aren't your style feel free to tune back in at 3pm!
2010-05-25 20:16:05 +0000,Tune in to John and Ken at:2pm today to hear Carly discuss w @ChuckDevore @TalktoTom and @CarlyforCA http://www.kfiam640.com/main.html
2010-05-25 18:42:06 +0000,http://bit.ly/ai2jt3 CQ Politics: Political Wire: Fiorina Soars in Final Campaign Stretch
2010-05-25 18:14:18 +0000,http://bit.ly/bxuITl Policy Polling: Fiorina up big!!!!
2010-05-25 16:21:33 +0000,Politico: @ChuckDevore hangs hopes on muddled polling http://politi.co/csyrcO // even his internal shows @CarlyforCA in lead!
2010-05-25 15:38:16 +0000,Today at 2pm Pacific Carly is participating in a discussion with @talktotom and @chuckdevore. Listen live on http://www.kfiam640.com
2010-05-25 15:12:21 +0000,"MSNBC calls Carly the ""most likely candidate in November."" http://www.youtube.com/user/CarlyforCalifornia#p/u/0/3JZCDj8NGEI"
2010-05-25 12:51:16 +0000,"Morning read: @latimes says ""Conservatives ramp up attacks on Campbell... views clash w that of GOP's rank and file"" http://bit.ly/cClqMj"
2010-05-25 12:48:44 +0000,SF Chron's @cmarinucci on Obama's visit today: The visit comes as Boxer faces the fight of her life// that's right!
2010-05-24 23:50:34 +0000,Listen to @SBAList pres talk about Carly on @limbaugh this morning: http://www.youtube.com/user/CarlyforCalifornia
2010-05-24 23:32:31 +0000,"SurveyUSA: Fiorina's support has more than doubled among women, seniors, Hispanics..."
2010-05-24 23:24:13 +0000,As promised the link to the Survey USA Poll: http://www.surveyusa.com/client/PollReport.aspx?g=203d9267-8869-45c0-b3de-95ed057a54f9
2010-05-24 22:42:07 +0000,@timothypmurphy link coming soon!
2010-05-24 20:12:40 +0000,@AlanDana Thanks for the support Alan!
2010-05-24 19:21:50 +0000,Tune in to Bulls & Bears on Fox Business Network at 1pm Pacific/4pm Eastern to see Carly!
2010-05-24 18:34:32 +0000,"Breaking news: Fiorina 46%, Campbell  23%, DeVore 14% according to new Survey USA poll. Proof that hard work pays off! #casen"
2010-05-24 14:35:52 +0000,Carly's live on KTLA's morning news in 10 minutes-- Los Angeles followers tune in!
2010-05-22 19:12:07 +0000,Getting out the vote!! http://twitpic.com/1q3k3g
2010-05-22 19:05:26 +0000,Making calls!!! http://twitpic.com/1q3hu9
2010-05-22 19:00:12 +0000,Carly greeting campaign volunteers and phone banking http://twitpic.com/1q3g18
2010-05-22 17:08:13 +0000,"We have phone banks in Carmel, Hayward, Orange County, San Diego, Fresno, Long Beach & more firing on all cylinders this morning. Go Carly!"
2010-05-21 19:27:48 +0000,The @DSCC is worried about California. http://bit.ly/9oTsHz Using @CarlyforCA to raise funds bc they know she can beat Boxer.
2010-05-21 15:11:11 +0000,Carly has her eye on the ball: http://www.commentarymagazine.com/blogs/index.php/rubin/297631
2010-05-20 22:26:53 +0000,"http://www.youtube.com/user/CarlyforCalifornia#p/u/0/ytyKDA6TEQM Sarah Palin on Carly last night #casen, #palin, #tcot"
2010-05-20 22:20:19 +0000,http://www.mercurynews.com/breaking-news/ci_15127338 Mercury News: GOP Senate candidate Carly Fiorina praises disabled veterans program
2010-05-20 22:11:38 +0000,Mercury News: GOP Senate candidate Carly Fiorina praises disabled veterans program: http://www.mercurynews.com/breaking-news/ci_15127338
2010-05-20 20:44:16 +0000,Interesting: @TalktoTom trashes his own mail strategy: http://www.youtube.com/watch?v=QPCEUX5nVco
2010-05-20 20:40:46 +0000,http://bit.ly/9MEzx0 Obama to raise more $ for Boxer-- another rescue mission in action! She's vulnerable!
2010-05-20 15:41:37 +0000,Carly addressing Project HIRED's Wounded Warrior breakfast http://twitpic.com/1pf2wt
2010-05-20 15:40:59 +0000,The San Jose Mercury News on the state of the race: http://www.mercurynews.com/breaking-news/ci_15121804
2010-05-20 14:06:13 +0000,". @chuckdevore predicted doubling in polls due to deceptive ballot title. It worked, but he’s still a distant third. @carlyforca in lead!"
2010-05-20 04:23:36 +0000,"PPIC: Fiorina 25%, Campbell 23%, DeVore 16%. Poll confirms that hard work produces results and Carly has the momentum heading toward June 8."
2010-05-20 00:47:38 +0000,"Watch videos about Carly’s upbringing, business background, family, and more: http://carlyforca.com/about"
2010-05-20 00:10:07 +0000,@stevenmaviglio in 2007 who was named one of the best CEOs in America? Carly Fiorina #CASenJeopardy
2010-05-19 22:50:54 +0000,Career Politicians for $400: Career politician who proposed a 32-cent gas tax. Who is Taxin' Tom Campbell? #CASenJeopardy
2010-05-19 22:35:34 +0000,Career Politicians for $300: This person has been in office 28 years with little to show for it. Who is Barbara Boxer?
2010-05-19 22:22:21 +0000,Career Politicians for $200: Has run for statewide office 3 times and lost. Who is Tom Campbell?
2010-05-19 22:11:19 +0000,Career Politicians for $100: Career politician who loves higher taxes. A: Who is Taxin Tom Campbell?
2010-05-19 22:09:32 +0000,Hey Carly fans! Let's play some Jeopardy of our own! Stay tuned for questions!
2010-05-19 21:47:36 +0000,"Funny: On Jeopardy today, #SarahPalin was worth more than #Boxer. #casen #palin Even Trebek thinks she's vulnerable!"
2010-05-19 21:17:25 +0000,Tell your friends you support Carly by adding this icon to your Twitter profile: http://bit.ly/9nU7ke
2010-05-19 17:19:48 +0000,Hundreds of young people have joined Students for Carly! Get involved today: http://carlyforca.com/coalitions
