created_at,text
2011-08-22 12:47:57 +0000,"Looking forward to a couple of interviews today, starting with @CNBC at 7am pacific - lots to talk about in business and econ news!"
2011-08-13 15:05:13 +0000,About to go on the air with Neil Cavuto @foxnews - looking forward to it!
2011-08-09 04:20:18 +0000,"Time to get some sleep, I will be up bright and early for an interview with @theearlyshow. We'll be talking economy."
2011-08-03 14:00:36 +0000,"Great video! RT @NRSC ""Welcome to the Recovery"" - 1 Year Anniversary! http://t.co/FRP7Q2X #tcot"
2011-08-02 15:22:28 +0000,Getting ready for an interview with @FoxNews about the debt ceiling deal around 8:30 - hope you can tune in and let me know what you think.
2011-07-30 15:58:35 +0000,Thanks @TeamCavuto and @foxnews for having me on - a good discussion about a very important time for our country.
2011-07-30 15:45:50 +0000,Getting ready to go on @FoxNews with Neil Cavuto in a few minutes - we'll be talking all about the debt ceiling debate and the economy.
2011-07-29 20:56:38 +0000,I will be talking about the debt ceiling at 4:10 pacific today with Larry Kudlow on @cnbc. Hope you can tune in!
2011-07-26 00:20:39 +0000,Looking forward to serving on the Foundation for Health Coverage Education's Advisory Board. Learn more here: http://t.co/JvVbTfy
2011-07-20 19:05:54 +0000,Looking forward to another interesting exchange on @cnn with Anderson Cooper on #AC360 tonight - tune in if you can at 7pm pacific.
2011-07-13 20:02:58 +0000,Looking forward to guest hosting @CNBC 's Squawk Box tomorrow morning bright and early at 7am eastern!
2011-07-12 22:45:33 +0000,Big government is not the way to stronger economy - read more in my oped that @politico just posted: http://t.co/QwJ8CqT
2011-07-12 17:54:11 +0000,I am looking forward to working with @NRSC to help restore a Republican majority in #2012! http://t.co/3st1znj
2010-11-03 17:51:39 +0000,"The cause of taking our government back, making it listen & making it work does not end today. I am deeply grateful for your support. -Carly"
2010-11-03 06:17:14 +0000,Carly addressing the crowd http://twitpic.com/33gmfc
2010-11-03 06:16:37 +0000,Carly taking the stage http://twitpic.com/33gm8p
2010-11-03 06:14:07 +0000,Carly's about to take the stage.
2010-11-03 03:45:26 +0000,Watching returns w the family http://twitpic.com/33fbnd
2010-11-03 03:09:49 +0000,To be clear there are no election results yet in CA. Anything else reported is false.
2010-11-03 01:28:17 +0000,"If you haven't yet, please go vote. Every vote matters. It is going to be a very close race."
2010-11-03 00:44:54 +0000,"Have pics from your polling place?  Be sure to send them to contact@carlyforca.com, & we'll post to our Facebook Page http://on.fb.me/bEsiek"
2010-11-02 20:01:40 +0000,Have you done this today? http://twitpic.com/33bg03
2010-11-02 19:45:11 +0000,Phone banking in the OC! http://twitpic.com/33bbqv
2010-11-02 19:15:33 +0000,More volunteers than calls to make in Sacramento! #notabadproblemtohave
2010-11-02 18:30:43 +0000,"A big thank you to @TeamCarly for all their volunteer efforts on twitter, on the ground, making phone calls. Every vote counts!!!"
2010-11-02 15:10:27 +0000,Good morning! Don't forget to vote today! And vote for Carly!
2010-11-02 02:30:35 +0000,That's how it's done California! Let's show them again tomorrow! #sfgiants
2010-11-01 23:02:14 +0000,Tune in to John and Ken at 4:20 to hear Carly at www.kfiam640.com
2010-11-01 22:49:08 +0000,Let's go Giants! Let's clinch this! #sfgiants
2010-11-01 22:17:26 +0000,Carly and radio host Mark Larson http://twitpic.com/3324pu
2010-11-01 21:52:25 +0000,Lively phone bankers in San Diego! http://twitpic.com/331y62
2010-11-01 20:05:30 +0000,Getting out the vote in Pasadena!!! http://twitpic.com/33169x
2010-11-01 18:34:51 +0000,Not in CA but looking to help? Text JOIN to CARLY (22759) to phone bank from anywhere!
2010-11-01 18:33:41 +0000,"@ernieketcham you can phone bank! Thanks for the support, we appreciate it."
2010-11-01 17:14:17 +0000,Getting out the vote in Sacramento! http://twitpic.com/32zz7e
2010-11-01 17:11:12 +0000,Have you tweeted to remind your friends to vote for Carly tomorrow?
2010-11-01 16:58:36 +0000,@Seth_Unger  @TimAnaya Thanks for your hard work this election! And happy belated birthday to you Tim!
2010-11-01 15:06:10 +0000,Good morning! Time to get out the vote! Republicans are fired upland ready to go!
2010-11-01 03:49:30 +0000,Congrats to the Giants! One more! Here's to a victorious November!
2010-11-01 02:24:59 +0000,Halloween Carly style :) http://twitpic.com/32teov
2010-11-01 02:24:41 +0000,"Don't forget to say ""Boo"" to Barbara Boxer! http://twitpic.com/32tell"
2010-10-31 23:41:16 +0000,Rossmoore gets it right! http://twitpic.com/32rpfn
2010-10-31 23:27:19 +0000,Standing ovation for carly http://twitpic.com/32rjwm
2010-10-31 21:19:46 +0000,IMG00057.jpg http://twitpic.com/32q8mv
2010-10-31 20:59:55 +0000,Carly in Fresno #welovethevalley http://twitpic.com/32q1se
2010-10-31 20:16:35 +0000,Look at all those completed precincts! #turnout #we'vegotgame http://twitpic.com/32pnfx
2010-10-31 19:50:56 +0000,Packed house of phone bankers in Fresno http://twitpic.com/32pepn
2010-10-31 19:15:35 +0000,Happy Halloween! What’s scarier than 6 more years of Barbara Boxer’s failed policies??  Voters-- say “boo!” to them on Tues!
2010-10-31 18:54:24 +0000,@LisaMcIntire getting out the vote in Palm Springs! It was a great morning.
2010-10-31 18:43:20 +0000,Great event in Palm Desert this morning! Nothing like a golf cart parade and some coffee to start the day off right! Off to Fresno!
2010-10-31 16:54:25 +0000,Another gorgeous CA day to get out the vote! We're hopscotching the state to talk to you!
2010-10-31 15:31:03 +0000,Real Clear Politics just moved the race to toss up. On to victory on Tuesday!
2010-10-30 23:27:22 +0000,Chico for Carly!!! http://twitpic.com/32dgif
2010-10-30 21:53:58 +0000,Sacramento phone banking!!! http://twitpic.com/32clvc
2010-10-30 21:37:45 +0000,Dem and independent phone bank http://twitpic.com/32cgm6
2010-10-30 20:41:30 +0000,Phone bankers for Carly!!! http://twitpic.com/32byfr
2010-10-30 18:34:28 +0000,Getting out the senior vote at Lesure World Seal Beach!!! http://twitpic.com/32atpq
2010-10-30 17:27:49 +0000,College students hitting the road for Carly! #weloveourvolunteers http://twitpic.com/32a6ua
2010-10-30 17:17:10 +0000,What are you doing to retire Barbara Boxer today?
2010-10-30 17:15:02 +0000,@richardcostigan Keep the troops rallied! Let's get out that vote!
2010-10-30 16:34:27 +0000,What enthusiasm in San Diego! http://twitpic.com/329nl7
2010-10-30 16:26:05 +0000,"Huge get out the vote day! Look for Carly in a town near you! North, south, east, west..."
2010-10-30 16:25:01 +0000,Carly serving pancakes to precinct walkers! http://twitpic.com/329jz5
2010-10-29 21:42:48 +0000,Carly in Santa Barbara! http://twitpic.com/31zrgb
2010-10-29 19:24:01 +0000,Fmr CA Secretary of State Bruce McPherson in Salinas http://twitpic.com/31yoed
2010-10-29 19:22:27 +0000,http://www.ksbw.com/video/25566287/detail.html tune in now for Carly
2010-10-29 19:06:35 +0000,Tune in to www.ksbw.com at 12:20 to see Carly live #casen
2010-10-29 18:01:31 +0000,Carly talking jobs in the bay area http://twitpic.com/31xzwd
2010-10-29 15:51:32 +0000,We are all earing up for a busy day talking to the people of California about jobs and the economy!
2010-10-29 15:49:16 +0000,Great news! The Santa Clarita Signal endorsed us!
2010-10-29 03:22:13 +0000,Check out what @hannity had to say about some more ethics issues chasing @Boxer_2010 http://bit.ly/cUamji #casen @failedsenator
2010-10-29 01:57:49 +0000,@nickmarschel Thank you so much!
2010-10-29 01:57:42 +0000,@TpaforSarah Thank you!
2010-10-28 23:43:52 +0000,".@Boxer_2010 is trying to diffuse our money bomb. Don't let her! Donate now http://www.carlyforca.com/donate We want $280k, 10k per yr in DC"
2010-10-28 23:41:58 +0000,@Ericb1980 yes!
2010-10-28 23:06:22 +0000,Game #2 tonight! Let's go Giants!
2010-10-28 21:16:45 +0000,Check out former HP board member Sam Ginn's op-ed in the @sfchron on Carly's tenure at HP. http://bit.ly/daz17K #casen
2010-10-28 21:09:57 +0000,Time to head to the OC for event #2! Great event in Sacramento and 5 days left!
2010-10-28 19:36:20 +0000,Talking jobs in Sacramento http://twitpic.com/31no8e
2010-10-28 19:29:40 +0000,Carly about to speak live here http://bit.ly/c5GfxK
2010-10-28 19:18:36 +0000,Back to win! http://twitpic.com/31njvv
2010-10-28 19:14:27 +0000,Small dogs for Carly! http://twitpic.com/31nitf
2010-10-28 19:04:22 +0000,Supporters gathering to welcome Carly http://twitpic.com/31ngcn
2010-10-28 15:14:31 +0000,"MONEY BOMB!!!!! Help us raise 280,000 in 28 hours to end Boxer's 28 years. Donate here and pls RT! http://bit.ly/9Oix8T"
2010-10-28 02:31:26 +0000,Want to help? Text JOIN to CARLY to receive campaign updates and participate in our mobile phone bank. We need you! #casen
2010-10-27 22:44:19 +0000,Asm Nathan Fletcher campaigning for Carly in San Diego http://twitpic.com/31f0d7
2010-10-27 21:37:45 +0000,"Have you seen our new web ad, ""Truthiness?"" Learn the actual facts here: http://bit.ly/dw63dz"
2010-10-27 19:01:01 +0000,"Game one tonight, go Giants!  #sfgiants #californiaisawesome"
2010-10-27 18:28:46 +0000,Northern California rice farmers for Carly! #casen http://twitpic.com/31db7q
2010-10-27 17:31:06 +0000,Carly was given the good news that she’ll be released today & excited to get back on the campaign trail and on to victory!
2010-10-27 14:35:03 +0000,Boxer's hometown newspaper the Desert Sun endorsed Carly today adding to the growing list of endorsements! http://bit.ly/9RJxKM #casen
2010-10-27 01:58:22 +0000,Carly is thankful 4 all the prayers & encouragement received today. She's anxious 2 get back on the campaign trail and looking fwd 2 victory
2010-10-27 00:11:23 +0000,Check out @WSJ editorial on @Boxer_2010's hypocrisy @cisco today. http://tinyurl.com/2cesl3l Maybe she should return that campaign cash...
2010-10-26 23:30:32 +0000,Check out our new web ad about Boxer's hypocrisy: http://www.youtube.com/watch?v=OuUo60TnCFo #casen
2010-10-26 21:09:32 +0000,Mary Bono Mack decrying Boxer's 28 yrs of failed policies http://twitpic.com/314dm9
2010-10-26 20:38:18 +0000,Send us your yard sign photos like this one: Merced for Carly! #casen  http://twitpic.com/31468x
2010-10-26 19:15:50 +0000,"Great news! Music legend & spokes for non-partisan citizens group Pat Boone ""sings praises of Carly Fiorina"" and endorsed her today #CASEN"
2010-10-25 23:16:20 +0000,"DiFi when caught in a candid campaign moment and asked how things are going for Boxer said, ""bad"" says Mercury News"
2010-10-25 21:06:13 +0000,Fact about Bakersfield: According to the newspaper Boxer only comes here every 6 years. What else happens every 6? An election.
2010-10-25 20:46:58 +0000,"Grt day to campaign in the Central Valley. Bakersfield, Fresno... we're all over talking jobs & economy. Despite stimulus, unemp high here."
2010-10-25 19:29:47 +0000,Talking jobs in Bakersfield http://twitpic.com/30tu21
2010-10-25 15:13:34 +0000,"New TV ad, ""Crushed."" http://bit.ly/8XIlhz"
2010-10-25 13:33:09 +0000,National Journal: NRSC drops another $3 mil into race http://bit.ly/b9Kuzf
2010-10-25 04:39:52 +0000,Looking for a way to help us during the final 192 hours of this election? http://www.carlyforca.com/volunteer/ #casen
2010-10-25 04:36:42 +0000,@michaelyork thanks for coming! Tell your friends and keep the excitement up!
2010-10-25 03:00:39 +0000,Standing ovation for Carly at the Stephen Wise Temple in LA! http://twitpic.com/30n6eg
2010-10-24 19:43:47 +0000,The Sacramento victory headquarters is overflowing with Carly supporters making calls! Rain can't dampen our excitement!
2010-10-24 18:52:14 +0000,Ventura for Carly! #casen http://twitpic.com/30jdfr
2010-10-24 03:44:33 +0000,Congrats to the #sfgiants! Make California proud in the World Series!
2010-10-24 02:02:31 +0000,@mikebelshe Thanks! Now tell your friends!
2010-10-23 18:28:25 +0000,Adding to the endorsements and excitement today... the Redding Record-Searchlight endorsed Carly! http://bit.ly/bHeAeh #casen
2010-10-23 18:19:10 +0000,What a wonderful morning phone banking with energized women in San Jose today! Want to help? Text JOIN to 22759 to mobile phone bank #casen
2010-10-23 17:24:28 +0000,So many cheering volunteers in San Jose! http://twitpic.com/306d6r
2010-10-23 17:17:17 +0000,Carly phone banking in San Jose http://twitpic.com/306av9
2010-10-23 17:02:33 +0000,Carly interviewing w Savannah Guthrie on NBC http://twitpic.com/3065wb
2010-10-23 01:58:36 +0000,"Signs of Dem ""enthusiasm"" in CA... chant at Obama rally was, ""we're not exhausted!"" Really?"
2010-10-23 00:10:53 +0000,What have you done to retire Boxer today?
2010-10-22 23:26:48 +0000,"Yeah! Despite Obama rallying for @Boxer_2010 today, Politico says we won the day! http://politi.co/dBQ241 #casen (via @davecatanese)"
2010-10-22 22:50:56 +0000,"MSNBC thinks @Boxer_2010 is in trouble, watch here: http://bit.ly/aKDPPH #casen via"
2010-10-22 21:49:17 +0000,Carly is on with @hughhewitt at 3:20 pm tune in at hughhewitt.com #casen
2010-10-22 21:00:09 +0000,Carly rallying the troops in Stockton http://twitpic.com/2zvswr
2010-10-22 18:36:58 +0000,Show your support! Download the official Carly twibbon here! http://twibbon.com/join/carlyforcalifornia
2010-10-22 18:26:21 +0000,Latest Rasmussen has the race statistically tied with Boxer down 1 since last survey. #momentum
2010-10-22 18:14:39 +0000,Notes from today's Rasmussen poll: We’re up 50-45 to those “certain to vote” and 57-36 among those who already voted #momentum
2010-10-22 17:44:13 +0000,Are you an absentee or early voter? Make sure you do this! http://twitpic.com/2z4y92 #casen #11days
2010-10-22 17:20:19 +0000,"Carly supporters gathering at USC to ""welcome"" @Boxer_2010 http://twitpic.com/2zu7gf"
2010-10-22 16:16:34 +0000,"The director of Airplane!, Naked Gun, & Scary Movie 3 & 4 made another scary movie... one about @Boxer_2010 http://bit.ly/c9DCjN Watch now!"
2010-10-22 15:14:37 +0000,Check out Carly's appearance on Good Morning America this morning! http://bit.ly/c5Qj6l #casen
2010-10-21 23:00:07 +0000,"Great news! @abcnews changed our race from ""leans dem"" to ""toss-up!"" #casen #12days"
2010-10-21 22:27:23 +0000,@TimOdell thanks for the contribution! we need all the help we can get!
2010-10-21 21:44:01 +0000,@MauricioRaul your twibbon looks great!
2010-10-21 21:41:27 +0000,"OC Register on recent polling, ""Overall...Fiorina has narrowed the gap with Boxer."""
2010-10-21 19:32:13 +0000,Attention Los Angeles residents! Traffic alert tomorrow! Boxer and Obama have CA all jammed up! http://www.youtube.com/watch?v=kpe3GIGjI2Y
2010-10-21 18:09:32 +0000,.@aandgshow Armstrong and Getty on the race: http://bit.ly/d2ohSu #casen @650kste
2010-10-21 17:10:30 +0000,"The Latino Times is endorsing Carly! http://www.latinotimes.org/
 #casen"
2010-10-21 14:53:31 +0000,Washington Post: Senate race is tied http://wapo.st/b1J3LD
2010-10-21 04:22:55 +0000,.@LATimes on the poll: in the U.S. Senate race Republican Carly Fiorina seems to be slowly closing the gap between her and incumbent Boxer
2010-10-21 04:15:56 +0000,Good news in the PPIC poll. Carly's closing the gap and leads among independents despite being outspent 2:1 & vicious attack ads.
2010-10-21 00:52:25 +0000,@bull579 it looks GREAT!
2010-10-21 00:32:20 +0000,@VeganPatriot yeah!!! LOVE your twibbon!
2010-10-21 00:18:35 +0000,Show your support for Carly and add this Twibbon now! http://twibbon.com/join/carlyforcalifornia #casen
2010-10-20 22:33:08 +0000,Highway 1 for Carly!! http://twitpic.com/2zc8wz
2010-10-20 20:30:39 +0000,"@milo9 North County Times in San Diego, not North Carolina :)"
2010-10-20 19:49:35 +0000,"Count: LA Daily News, SDUT, OC Reg, Bakersfield Californian, Riverside PE, Fresno BEE, Modesto BEE, Chico ER, NC Times all endorsed Carly!"
2010-10-20 17:40:12 +0000,Announcing endorsements from prominent Latino Central Valley leaders in Mendota. W/ unemployment @ 40% time 4 chan http://twitpic.com/2zabvy
2010-10-20 17:38:21 +0000,SLO Tribune: Farmers criticize @Boxer_2010: http://bit.ly/cDtUp4 #casen
2010-10-20 16:52:29 +0000,The Merced Sun-Star endorsed Carly today! Check it out: http://bit.ly/bkEQxf #casen
2010-10-20 16:26:25 +0000,"Check out our new ad called, ""Bickering."" http://ow.ly/2Ww9g #casen"
2010-10-20 01:23:28 +0000,If you are an absentee voter you need to do this today! #casen http://twitpic.com/2z4y92
2010-10-19 23:22:52 +0000,Kern County for Carly! http://twitpic.com/2z4320
2010-10-19 22:41:05 +0000,"Per a new poll Carly leads @Boxer_2010 46%-43% http://bit.ly/99uWBH
#casen Volunteer or donate here: http://www.carlyforca.com"
2010-10-19 20:30:10 +0000,Tune in to http://www.kmjnow.com at 1:40 to hear Carly live with Ray Appleton! #casen #WeLoveFresno
2010-10-19 19:56:46 +0000,When asked today how to drum up dem enthusiasm Wille Brown noticeably cited CA politicians OTHER than @Boxer_2010
2010-10-19 18:50:30 +0000,"Check out our new web video: ""Zero"" http://j.mp/9nldFg  #FailedSenator"
2010-10-19 18:12:39 +0000,From the @SFChron http://bit.ly/bLIW1j More on the VFW and @SenJohnMcCain
2010-10-19 16:51:27 +0000,Harley Vets for Carly! http://twitpic.com/2z1hr1
2010-10-19 14:46:33 +0000,Tune in to Armstrong and Getty at www.kste.com now to hear Carly!
2010-10-18 22:38:55 +0000,Kermit for Carly! http://twitpic.com/2yuazi
2010-10-18 21:01:11 +0000,.@WSJ: VFW Shuts Off Campaign Arm http://bit.ly/c6vDhB #casen
2010-10-18 18:55:29 +0000,Don't forget that today is the last to register to vote for the election! Go to http://www.sos.ca.gov to register today! #casen
2010-10-18 17:27:02 +0000,BREAKING: VFW moves to dissolve its PAC effective Oct 15 over member outrage on endorsements http://politi.co/9OFZAZ
2010-10-18 17:05:52 +0000,The Hispanic Leadership Fund endorsed Carly today!
2010-10-16 22:33:34 +0000,16 days and ready to end @Boxer_2010's 28 long years! http://twitpic.com/2y8al1
2010-10-16 22:29:28 +0000,Carly firing up the troops (although they're so excited they don't need it)! http://twitpic.com/2y89ce
2010-10-16 22:09:08 +0000,Hundreds gathering in El Dorado Hills to hear Carly #casen http://twitpic.com/2y835t
2010-10-16 18:16:03 +0000,Want to help us retire @Boxer_2010? Text JOIN to CARLY to join our mobile phone bank from anywhere in the US!
2010-10-16 16:26:04 +0000,"Sen McCain, Carly and veterans in San Diego http://twitpic.com/2y541v"
2010-10-16 16:05:41 +0000,Mercury News: Fiorina running strong as Election Day draws near: http://bit.ly/bJRRos #casen
2010-10-15 23:10:53 +0000,Check out Carly on CNBC at 4:35 pm (Pacific) with John Harwood!
2010-10-15 21:02:22 +0000,New Reuters poll shows the race too close to call! http://bit.ly/dxsf6J #casen
2010-10-15 20:19:12 +0000,"You can send @Boxer_2010 home after 28 long, failed years in DC but we need your help! http://www.carlyforca.com/donate #casen"
2010-10-15 20:10:28 +0000,"Proving there's broad support to end @Boxer_2010's 28 years in Washington, Carly raised nearly $9 mil this quarter! #casen #keepitcomin'"
2010-10-15 00:34:58 +0000,FLASHBACK: @Boxer_2010 looks to staffer for answer http://bit.ly/6F2aGx... and here's today http://bit.ly/cYU1kF #somethingsneverchange
2010-10-15 00:17:13 +0000,Uh oh... @Boxer_2010 got a little mixed up on @wolfblitzercnn today http://bit.ly/d52QHr #casen #careerpolitician #knowyourtalkingpoints
2010-10-15 00:04:57 +0000,Barns for Carly! #californiaforcarly #soawesome http://yfrog.com/5e1dj
2010-10-14 21:38:38 +0000,Check out the photos from the 200 folks protesting Boxer in Lincoln yesterday: http://on.fb.me/dB4NI9 #ourvolunteersrock
2010-10-14 20:53:33 +0000,".@hughhewitt today: Less than 3 weeks to the vote & the Rep grassroots are pouring on the money &  energy, the Dem candidates are in hiding"
2010-10-14 18:46:10 +0000,Check out Jim Rowol from CA-VFW talk about the outrage surrounding their endorsement of @Boxer_2010 http://bit.ly/9FgTSq
2010-10-14 18:39:56 +0000,"What isn't @Boxer_2010 doing today? Standing w Feinstein, Sec Salazar, Reps Cardoza, Costa & McNerny & others addressing h20 in Delta."
2010-10-14 16:51:00 +0000,Thanks to everyone for supporting our money bomb yesterday! We raised some good $ to retire @Boxer_2010 but it's not 2 late to give more! :)
2010-10-14 01:39:31 +0000,"@2012Hopeful nope, standard text messaging rates apply."
2010-10-14 01:18:08 +0000,@elizabeth7184 just standard text fees through your phone's plan.
2010-10-14 00:57:59 +0000,Want to help retire Barbara Boxer? Text CALLS to 22759 to phone bank on behalf of Carly from anywhere in the world! #casen #retireboxer
2010-10-13 22:52:21 +0000,Bakersfield brings out the cookie! #yum #cookiesforcarly #casen #ourvolunteersrock http://yfrog.com/3wyisj
2010-10-13 21:23:11 +0000,"Word on the street is that Boxer was greeted by nearly 200 protesters in Lincoln, CA today. Photos to come! #casen"
2010-10-13 19:52:17 +0000,Carly receiving the endorsement of the Fresno Deputy Sheriff's Assn! http://twitpic.com/2xcd25
2010-10-13 19:50:43 +0000,We've almost met our moneybomb goal! Will you donate $10 today to retire Barbara Boxer? http://www.carlyforca.com/donate
2010-10-13 18:34:50 +0000,AP: VFW calls on its own PAC to rescind endorsements (including @Boxer_2010) http://bit.ly/9hKVNM #casen #failesenator
2010-10-13 17:06:06 +0000,Interesting & telling that Boxer voted yesterday but refused 2 give her positions on CA's props. Read more here: http://bit.ly/aCu41v #casen
2010-10-12 23:15:47 +0000,"BREAKING: VFW is ""requesting the chairman and the directors of the VFW-PAC immediately rescind their endorsement actions"" incl @Boxer_2010"
2010-10-12 23:13:32 +0000,Town hall in Redding-- nearly 400 supporters ready to work! http://twitpic.com/2x3yee
2010-10-12 21:53:18 +0000,Woo hoo! Today Carly was proud to receive the endorsement of the Central California Hispanic Political Action Committee! #casen
2010-10-12 19:34:01 +0000,RT @kyleraccio is definitely in the mood for home phonebank GOTV @CarlyforCA @TeamCarly// text CALLS to CARLY to mobile phone bank!
2010-10-12 17:36:34 +0000,SF Chron: Carly Fiorina goes on the attack: http://bit.ly/aDjuXO #casen
2010-10-12 17:35:10 +0000,"Miss the ""Truth"" about Carly's record at HP? Watch this video & hear about it by those who worked with her http://bit.ly/cgYuUt f#casen"
2010-10-12 15:17:42 +0000,@osidejt Thanks Jon! Spread them far and wide! :)
2010-10-12 14:25:03 +0000,"We launched 2 new TV ads today. Watch ""Label"" here: http://bit.ly/dnDVqH and ""Buck"" here http://bit.ly/doreLa #casen"
2010-10-12 14:23:33 +0000,Great news! Carly was endorsed by the North County Times! Read it here:  http://bit.ly/dtF4sb #casen
2010-10-12 00:09:03 +0000,Read the Press Enterprise endorsement here: http://bit.ly/bLX6bh #casen
2010-10-12 00:06:29 +0000,Riverside Press Enterprise endorsed Carly!
2010-10-11 22:38:39 +0000,@SenJohnMcCain Thanks! We're looking forward to the weekend!
2010-10-11 21:15:21 +0000,"Check out ""Truth"" - our new video about @CarlyforCA's time at HP from the people who worked with her http://bit.ly/acCWrz #casen"
2010-10-11 21:05:52 +0000,"Check out ""Truth"" - our new video about @CarlyforCA's time at HP from the people who worked with her: http://tinyurl.com/2fhqxwd #CAsen"
2010-10-11 19:56:34 +0000,Tune in here to hear Orson Swindle on @hotair at 1pm to discuss VFW PAC controversy: http://hotair.com/hotair-tv-ed-morrissey-show/
2010-10-11 18:07:57 +0000,Just a few reporters checking out America's Mayor and Carly today http://twitpic.com/2wrxa5
2010-10-11 17:58:57 +0000,Mayor Giuliani and Carly in Orange County http://twitpic.com/2wruou
2010-10-11 17:11:11 +0000,Check out what legendary war hero Orson Swindle had to say about VFW-PAC's endorsement of Boxer on Fox this AM: http://bit.ly/cgtaGN
2010-10-11 16:36:09 +0000,This week's Weekly Standard cover http://twitpic.com/2wr6mv
2010-10-11 15:44:46 +0000,Carly will be on Dennis Prager this morning at 9am! Tune in!
2010-10-11 02:38:38 +0000,@Ryanexpress77 the LA Daily News did!
2010-10-11 00:40:22 +0000,Of course we can't forget that Boxer's hometown newspaper the SF Chronicle refused to endorse her!
2010-10-11 00:40:02 +0000,"Weekend newspaper endorsement count: Fresno Bee, Bakersfield Californian, OC Register & San Diego Union Tribune!"
2010-10-11 00:37:41 +0000,Check out the photos from today's protest of VFW-PAC's endorsement of @Boxer_2010 here: http://on.fb.me/bDJxCT
2010-10-10 22:10:59 +0000,@3fecta We got it yesterday!
2010-10-10 20:22:57 +0000,Nearly 100 vets protesting Boxer http://twitpic.com/2wh699
2010-10-10 20:17:19 +0000,"Veterans saying ""no ma'am"" to VFW-Pac's endorsement of Boxer in LA- crowd's getting bigger by the minute! http://twitpic.com/2wh4je"
2010-10-10 20:11:21 +0000,The San DIego Union Tribune endorsed Carly today! http://bit.ly/dd3pia
2010-10-10 01:30:33 +0000,More cute kids for Carly! http://twitpic.com/2w6w1b
2010-10-10 01:17:30 +0000,@jas255 @kuo929 Thanks for your hard work! Tell your friends and keep it up.
2010-10-09 20:51:58 +0000,Carly waving the flag! #casen http://twitpic.com/2w4c7n
2010-10-09 19:31:07 +0000,Carly with husband Frank at the Auto Club 300 #nascar http://twitpic.com/2w3msu
2010-10-09 18:46:40 +0000,RT @MaxwellLCopello Great turnout! Precinct walk for @Whitman2010 @CarlyforCA k in Sacramento http://yfrog.com/45jygj //thanks!!
2010-10-09 18:41:18 +0000,Carly and David Hasslehoff at the Auto Club Speedway 300 in Fontana #nascar #thehoff http://twitpic.com/2w36ue
2010-10-09 16:04:23 +0000,Check out what the Bakersfield Californian had to say about Carly. Boxer's time is up http://bit.ly/cQ40b5 #casen #turnthewaterbackon
2010-10-09 16:01:06 +0000,Check out this great video made by Students for Carly! We love you! http://bit.ly/apRavA #casen #weloveourvolunteers
