created_at,text
2015-09-19 01:00:13 +0000,Help us keep up the momentum. Join our team today: https://t.co/UsOPl1d8f1 #Carly2016
2015-09-19 00:27:03 +0000,Thanks Gov. @NikkiHaley &amp; @Heritage_Action for having me speak! #HeritageActionForum #Carly2016
2015-09-18 23:25:08 +0000,"Coming up shortly at #HeritageActionForum. If you’re not there, watch live here: http://t.co/D7BBk7awu9 #Carly2016"
2015-09-18 23:00:19 +0000,"Since the debate, we've had a huge swell in momentum. Chip in $3 now to keep it going: https://t.co/2XkmbvKuBN #Carly2016"
2015-09-18 21:47:53 +0000,Want to know where I stand on the issues? Search videos of hundreds of my answers: https://t.co/SuzVUhikdg #Carly2016
2015-09-18 20:14:26 +0000,Thank you to the attendants on my @USAirways flight today for such a kind &amp; thoughtful note! #Carly2016 http://t.co/nJXn41QI6x
2015-09-18 19:27:52 +0000,"This is about fixing America’s problems with bold ideas &amp; strong leadership. https://t.co/UsOPl1d8f1 #Carly2016
https://t.co/3s8gop1RQR"
2015-09-17 21:44:32 +0000,I dare @HillaryClinton &amp; @BarackObama to watch these videos &amp; tell Americans we should fund them w/ taxpayer $$. http://t.co/E0QN2Y9PWE
2015-09-17 20:40:40 +0000,Happy Constitution Day. http://t.co/fQLtSmJ5rk
2015-09-17 16:35:27 +0000,"Every American’s life must be filled with the possibilities that come from their God-given gifts. #Carly2016
https://t.co/ibpxqiQmMV"
2015-09-17 12:04:42 +0000,Now I’m about to join @Morning_Joe on @msnbc. #Carly2016 #CNNDebate
2015-09-17 11:16:06 +0000,Up next with @foxandfriends. Hope you can tune into @FoxNews. #Carly2016 #CNNDebate
2015-09-17 10:50:08 +0000,I’m joining @NewDay on @CNN shortly. Tune in if you can! #Carly2016 #CNNDebate
2015-09-17 03:11:56 +0000,"Putin won't listen to talk. We need leadership and resolve. Pitch in $3. https://t.co/2XkmbvKuBN
https://t.co/j1Dv1W4tnT"
2015-09-17 03:05:41 +0000,"Politicians won't defend the character of our nation. Americans must. Pitch in $3. https://t.co/2XkmbvKuBN
https://t.co/MdGN5LIioF"
2015-09-17 02:56:27 +0000,"It's about more than replacing a D with a R. Pitch in $3 to help make our voice heard. https://t.co/2XkmbvKuBN
https://t.co/837MbzAp4A"
2015-09-17 02:48:18 +0000,"Politicians kicked the can on immigration for years. Chip in $3 for leadership &amp; results. https://t.co/2XkmbvKuBN
https://t.co/ftgIjBhvCh"
2015-09-16 22:25:49 +0000,Chip in $3 now to help me keep taking on the political class when the debate ends: https://t.co/IGjTdZG5za #Carly2016
2015-09-16 21:35:36 +0000,Just finished my walkthrough of tonight’s stage. Tune in at 8:00 p.m. ET! #Carly2016 #CNNDebate http://t.co/pELwM1azkc
2015-09-16 14:59:47 +0000,I hope you’ll tune into CNN at 8:00 p.m. ET! Follow #Carly2016 &amp; #CNNDebate for updates. http://t.co/rNvbhbUtl0
2015-09-16 00:57:57 +0000,My interview with @megynkelly airs on #KellyFile soon. Tune into @FoxNews if you can. #Carly2016
2015-09-15 22:05:56 +0000,I’m joining @hughhewitt on the air shortly. Hope you can tune in. http://t.co/BMkqdaMygx #Carly2016
2015-09-15 18:25:10 +0000,"Thanks to your help, we’re going to be on the debate stage tomorrow. I hope you’ll tune in at 8:00 p.m. ET! http://t.co/rN5jnpsoHU"
2015-09-14 15:54:06 +0000,Look at this face. This is the face of a 61 year old woman and I am proud of every year and every wrinkle. Watch: https://t.co/m9tJ1o5KmE
2015-09-13 17:20:07 +0000,"Took a lunch break at Arnie's Place in Concord, NH to catch up with @JohnJHarwood. #nhpolitics #Carly2016 http://t.co/aiM0NiHr1L"
2015-09-13 17:07:28 +0000,"Thank you, @NFRW, for such a resounding victory in your straw poll! #Carly2016 #gopwomendecide"
2015-09-13 00:00:09 +0000,I’ve answered hundreds of questions. You can search my answers here before Wednesday’s debate: https://t.co/SuzVUh0IOG #Carly2016
2015-09-12 19:30:12 +0000,"I’m in the debate, but the fight is just starting. Help me prepare: https://t.co/XmlRIBqsCU #Carly2016 http://t.co/el5dWC7iBZ"
2015-09-12 17:36:26 +0000,All issues are women’s issues. Enjoyed speaking to the @NFRW last night! https://t.co/osy3zurnXW #gopwomendecide #Carly2016
2015-09-12 00:31:18 +0000,I'm calling into @oreillyfactor with guest host @ericbolling soon. Hope you can tune in. http://t.co/zHQAsz9Q8I #Carly2016
2015-09-10 20:32:55 +0000,Only a few hours left to enter a to win VIP trip to the next presidential debate! https://t.co/Pn4FjUpats #Carly2016 http://t.co/DWzUcZG7V6
2015-09-10 00:53:06 +0000,Coming up shortly with @megynkelly on @FoxNews. Hope you can watch! http://t.co/VUHR7rUpT3 #Carly2016 http://t.co/km9lmEq0ah
2015-09-09 21:16:50 +0000,Tonight around 9:10 p.m. ET I’m joining @megynkelly on #KellyFile. Tune in! http://t.co/VUHR7rUpT3 #Carly2016 http://t.co/OLJVpCJhfR
2015-09-09 20:44:47 +0000,"Because of you, I’m going to be on that stage. To say thanks, we’re giving away a ticket. Enter here: https://t.co/R35dQdXHK0 #Carly2016"
2015-09-09 18:50:07 +0000,"China, Russia, Iran &amp; terrorist groups such as ISIS – these are the big human rights tests of our time. https://t.co/akA7l7PCxd #Carly2016"
2015-09-09 18:40:04 +0000,We are going to make it very hard for Iran to move money around the global financial system. https://t.co/akA7l7PCxd #Carly2016
2015-09-09 18:30:15 +0000,"On day one in the Oval Office, my message to Iran: New deal. https://t.co/akA7l7PCxd #Carly2016"
2015-09-09 18:20:52 +0000,Here’s what I'll do about Iran when I'm President: https://t.co/akA7l87dVN #Carly2016
2015-09-09 15:16:37 +0000,.@HillaryClinton There are barely any rules to bend. This is a bad deal and it doesn't need to be enforced - it needs to be scrapped.
2015-09-09 13:27:49 +0000,Enter to win a VIP trip to the debate at @ronaldreagan40: https://t.co/R35dQdXHK0 #Carly2016
2015-09-08 23:00:18 +0000,"Want to go to the debate at @ronaldreagan40, as my guest? Enter here: https://t.co/R35dQefiBy #Carly2016"
2015-09-08 18:00:17 +0000,Thank you @TomBoucherNH for a great event on Sunday. We have to challenge the status quo in Washington. http://t.co/upPGaUmKiG #Carly2016
2015-09-08 14:20:39 +0000,"Leadership’s job is to produce results, &amp; when leaders don’t produce results, they need to step aside. http://t.co/oS7dU1k9g1 #Carly2016"
2015-09-07 23:03:16 +0000,"Frank and I were honored to walk with supporters at today's Labor Day Parade in Milford! #nhpolitics #Carly2016
https://t.co/fNI9fwoJgm"
2015-09-07 17:09:22 +0000,Rolling out the Puppies for Carly Coalition at the Milford Labor Day Parade! #Carly2016 #nhpolitics http://t.co/ZWIemzDzUX
2015-09-07 13:41:40 +0000,"We have a professional political class that is unwilling or unable to challenge the status quo. #Carly2016
https://t.co/tyUvoWdRdg"
2015-09-07 02:31:15 +0000,"Thank you, Copper Door, &amp; to our supporters for the birthday wishes &amp; cake in Bedford! #nhpolitics #Carly2016
https://t.co/MhDTq9q4DY"
2015-09-06 21:43:56 +0000,Thank you to MaryAnn's Diner for such a great welcome &amp; to the Carson's for the birthday cake! http://t.co/Y532ZnYEkL
2015-09-06 18:17:12 +0000,Thank you to the team at @carlyforamerica for the birthday card &amp; to so many who have wished me a happy birthday! https://t.co/DLiRxw2XJB
2015-09-05 23:00:12 +0000,Tomorrow morning I’m joining @FaceTheNation on CBS. Check your local listings and tune in! http://t.co/maldyOvKlZ #Carly2016
2015-09-05 20:21:59 +0000,Good to walk Ward 1 in Manchester with @GatsasForMayor today. Vote for him on September 15! #nhpolitics
2015-09-05 00:11:46 +0000,I’ve answered hundreds of questions on the campaign trail. Search those answers here: https://t.co/SuzVUhikdg #Carly2016
2015-09-04 22:45:16 +0000,Back in New Hampshire this weekend. Hope to see you at one of our stops! http://t.co/U0O87AXxwc #nhpolitics
2015-09-04 15:22:10 +0000,Want to get to know my husband Frank? Listen to his talk with @greta here: http://t.co/LTKI7CNOLO
2015-09-04 01:38:00 +0000,It is critically important that America lead again in the world. My full interview w/ @hughhewitt: https://t.co/ZUKiAMXbCU #Carly2016
2015-09-04 01:09:18 +0000,.@HillaryClinton won't answer the tough ?'s: http://t.co/lDKvlnKOkX I will: https://t.co/SuzVUhikdg #Carly2016
2015-09-03 23:41:23 +0000,My interview with @hughhewitt is coming up. Tune in! http://t.co/BMkqdaMygx #Carly2016
2015-09-03 21:00:09 +0000,"Lois Lerner goes on paid administrative leave from the IRS, but KY clerk #KimDavis goes to jail?"
2015-09-03 18:39:07 +0000,Read more about my plan to restore America’s role in the world here: https://t.co/akA7l7PCxd #Carly2016 (3/3)
2015-09-03 18:38:04 +0000,"On my first day in the Oval Office, the Supreme Leader of Iran will get the message: New deal. https://t.co/akA7l7PCxd #Carly2016 (2/3)"
2015-09-03 18:37:05 +0000,President Obama &amp; John Kerry got rolled on the Iran deal. This is a terrible deal. https://t.co/akA7l7PCxd #Carly2016 (1/3)
2015-09-03 10:57:55 +0000,I'm joining @NewDay on @CNN shortly. Tune in! http://t.co/PylDcjbyM8 #Carly2016
2015-09-03 01:45:03 +0000,I’m looking forward to talking with @seanhannity on @FoxNews tonight. http://t.co/VUHR7rCOut #Carly2016
2015-09-02 20:17:42 +0000,Cool game by the team at @carlyforamerica: http://t.co/1aJXIfRGQN #Carly2016
2015-09-02 19:20:03 +0000,Joining @seanhannity on the air shortly. I hope you’ll listen in. http://t.co/VbQ0iBe3KM #Carly2016
2015-09-02 13:58:52 +0000,I'm joining @IngrahamAngle on the air around 10:05 a.m. EST. Tune in! http://t.co/706sR5k93J #Carly2016
2015-09-01 23:08:50 +0000,Huge news: I'm in the debate. But the fight's just starting. Help me prepare: https://t.co/fLfLUB1NDF http://t.co/VkrwCk42dS
2015-09-01 22:16:45 +0000,…and thank you to @RealBenCarson and @realDonaldTrump who spoke out in support of a fair debate process.
2015-09-01 22:15:44 +0000,"THANKS TO YOU, we will be able to share our message of leadership and citizenship with Republican voters on the main debate stage."
2015-09-01 19:48:16 +0000,We were forwarded this letter today. Grateful for the support of so many from across the country. https://t.co/wgeBmnove3 #Carly2016
2015-08-31 22:11:55 +0000,CNN is using funny math to keep Carly off the debate stage. We need your help to fight back. https://t.co/jEX69UixVj http://t.co/8qA7hBSuU2
2015-08-31 14:50:04 +0000,I'm looking forward to joining @SimonRadio1776 on the air shortly! #Carly2016 #iacaucus
2015-08-29 23:00:15 +0000,"I believe in answering the tough questions, not delivering more soundbites. https://t.co/SuzVUh0IOG #Carly2016"
2015-08-29 20:15:05 +0000,"To see over 200 videos of where I stand on the issues, head here: https://t.co/SuzVUh0IOG #Carly2016"
2015-08-29 18:15:06 +0000,Here's my take 5 video with @meetthepress last week. https://t.co/8LgIcmfLzb #Carly2016
2015-08-29 17:59:47 +0000,Wrapped up this week's Iowa trip speaking with @iowa_corn this morning. See you again soon. #Carly2016 #iacaucus
2015-08-28 23:00:16 +0000,Too often the political class speaks in soundbites. I’m willing to answer the tough questions. http://t.co/sIWIyxiodv #Carly2016
2015-08-28 21:12:47 +0000,"Today in Iowa I enjoyed hearing from voters in Storm Lake, Carroll, and Ames. #Carly2016 #iacaucus http://t.co/tRuqNxX46E"
2015-08-28 20:48:25 +0000,I’m willing to answer any question about any topic. You can search my answers here: http://t.co/sIWIyx0NlX #Carly2016 http://t.co/dk62z8sAxw
2015-08-28 20:13:10 +0000,"Unlike @HillaryClinton, I’m not afraid of answering the tough questions. Search my answers here: http://t.co/sIWIyx0NlX #Carly2016"
2015-08-28 18:31:34 +0000,I always answer the tough questions. Search my answers now at http://t.co/sIWIyx0NlX to see exactly where I stand. http://t.co/7gnOZrUdH8
2015-08-28 17:37:24 +0000,"Our campaign car just hit a deer in Iowa. Everyone is fine, but per @ChuckGrassley, assume deer dead."
2015-08-28 15:28:48 +0000,"Democrats are continually describing Republicans as extreme when the truth is the Democrats are extreme. #Carly2016
https://t.co/LhcqfH1jBG"
2015-08-28 13:00:23 +0000,Joining @marthamaccallum on @AmericaNewsroom shortly. Tune in on @FoxNews if you can! http://t.co/VUHR7rCOut #Carly2016
2015-08-28 01:08:11 +0000,Thank you to the @dordtrepublican for hosting me in Sioux Center today. #Carly2016 #iacaucus http://t.co/pRcQlye8m0
2015-08-27 22:10:05 +0000,I’m going On the Record with @greta tonight. Tune in! http://t.co/VUHR7rCOut #Carly2016
2015-08-27 18:10:08 +0000,I’m looking forward to this afternoon’s townhall in Sioux Center hosted by @dordtrepublican! @CRNC #Carly2016 #iacaucus
2015-08-27 17:11:13 +0000,"Thank you, Le Mars, Iowa, for a great townhall today! #iacaucus #Carly2016 http://t.co/uohDXwtZ1K"
2015-08-27 14:15:06 +0000,I’m joining @IngrahamAngle on the air shortly. You can listen here: http://t.co/706sR5BJVh #Carly2016
2015-08-27 13:58:41 +0000,Thanks so much to Charlie Stone and @kscj1360 for having me in studio today. #iacaucus #Carly2016
2015-08-27 02:38:03 +0000,.@SteveKingIA thank you for being there and for introducing me!
2015-08-27 02:05:09 +0000,Politicians talk. Leaders show results. http://t.co/MKaaZ6aewb https://t.co/vS2xZvTz6c
2015-08-27 01:53:31 +0000,Can't forget my Max and Snickers on #NationalDogDay. http://t.co/KaovlTWtX7
2015-08-27 00:29:24 +0000,Big crowd at the Cushing Fire Dept. for this evening's townhall hosted by @IowaFRW. Glad to be back in Iowa! http://t.co/vNDUwhbV8O
2015-08-26 22:40:08 +0000,Around 7:05 p.m. ET I’m joining @hughhewitt on the air. Hope you can tune in! http://t.co/BMkqdb4985 #Carly2016
2015-08-26 19:34:04 +0000,"I have a clear track record of challenging the status quo and producing results. #Carly2016
https://t.co/niLGHboGuQ"
2015-08-26 10:07:13 +0000,I'm calling into @Morning_Joe shortly. Hope you can tune in! http://t.co/WioAAsykjZ #Carly2016
2015-08-26 01:45:51 +0000,"We need a total rewrite of our tax code. RT if you agree. #Carly2016
https://t.co/VWKIjPYVz4"
2015-08-25 19:40:45 +0000,"As SOS, @HillaryClinton surely knew that she would be engaged in sensitive communications. #Carly2016
https://t.co/rlEzegzXvA"
2015-08-25 19:00:56 +0000,Our momentum is building across the country. Join our team today and help keep it going. https://t.co/UsOPl0Vxnt #Carly2016
2015-08-25 17:50:08 +0000,My full interview with @TrishIntel is airing shortly on @FoxBusiness. Hope you’ll tune in! http://t.co/qZLvf5xYmR #Carly2016
2015-08-25 00:38:53 +0000,"Here’s what the new deal with Iran will be when I’m President. https://t.co/UsOPl1d8f1 #Carly2016
https://t.co/wocT3wXBGu"
2015-08-24 21:50:04 +0000,I’m calling into @NECN shortly. Hope you can tune in! #Carly2016
2015-08-24 19:29:25 +0000,"President Obama broke every rule of negotiation with Iran. https://t.co/UsOPl1d8f1 #Carly2016
https://t.co/GiCnW6DwFT"
2015-08-24 17:48:35 +0000,Now I’m about to join @trish_regan on @FoxBusiness. http://t.co/qZLvf5xYmR #Carly2016
2015-08-24 13:47:45 +0000,"Small business creates two-thirds of the new jobs &amp; employs half the people in this country. #Carly2016
https://t.co/XuWXoHAEVl"
2015-08-24 12:05:07 +0000,I’m coming up with @foxandfriends. Tune in! http://t.co/VUHR7rCOut #Carly2016
2015-08-24 00:11:00 +0000,"We have to make it very painful for the Chinese to be aggressive in cyber warfare. #Carly2016
https://t.co/4pDK68MXeQ"
2015-08-23 18:41:20 +0000,Thanks to the Goffstown Republican Committee for having me speak at this afternoon's picnic! #Carly2016 http://t.co/g6jNKo0kq3
2015-08-23 16:35:23 +0000,"We must secure our border. It's not rocket science. https://t.co/UsOPl1d8f1 #Carly2016
https://t.co/8Gimh6LKHp"
2015-08-22 23:00:27 +0000,Enjoyed talking with @chucktodd. Catch the interview on @meetthepress tomorrow! http://t.co/bGqRWZv7HP #Carly2016 http://t.co/dxseNM37Jz
2015-08-22 22:29:42 +0000,Beautiful evening in Center Harbor. Thanks to the Viens for hosting! #Carly2016 #nhpolitics http://t.co/yAJuDt9DV4
2015-08-22 18:32:49 +0000,Good to speak with @NHGOP activists today in Bartlett! #Carly2016 #nhpolitics http://t.co/NHqzzJXSyR
2015-08-22 00:00:14 +0000,Sunday morning my interview w/ @chucktodd is airing on @meetthepress. Check your local listings! http://t.co/bGqRWZv7HP #Carly2016
2015-08-21 21:47:04 +0000,Good to speak and take questions at the Lancaster VFW this afternoon! #Carly2016 #nhpolitics http://t.co/oVsE1lJmcv
2015-08-21 20:34:20 +0000,The momentum we’re building across the country is real. Join our team today &amp; help keep it going. https://t.co/UsOPl0Vxnt #Carly2016
2015-08-21 14:15:06 +0000,Coming up with Peter St. James on the NH Wakeup Show. Hope you can listen in! http://t.co/Bc3HdUbU4f #Carly2016 #nhpolitics
2015-08-21 12:55:05 +0000,Talking with @wkxlnhchris shortly. You can listen here: http://t.co/ROJE0UChQI #Carly2016 #nhpolitics
2015-08-20 22:41:23 +0000,Full house for tonight's spaghetti dinner at the Littleton VFW! #Carly2016 #nhpolitics http://t.co/BS7B9unGU5
2015-08-20 20:30:16 +0000,My radio interview with @seanhannity is airing around 5:00 p.m. ET. Tune in! http://t.co/VbQ0iBe3KM #Carly2016
2015-08-20 19:13:00 +0000,"Americans are tired of politicians saying something and never delivering results. https://t.co/UsOPl1d8f1 #Carly2016
https://t.co/yEDxncb3yL"
2015-08-20 00:58:05 +0000,I'm joining guest host @marthamaccallum on #KellyFile shortly. Hope you'll tune in! http://t.co/VUHR7rCOut #Carly2016
2015-08-19 23:38:49 +0000,I'm looking forward to joining @hughhewitt live shortly. Listen here:  http://t.co/BMkqdb4985 #Carly2016
2015-08-19 23:03:07 +0000,Great turnout at tonight's townhall hosted by the Belknap County GOP. Thank you! #Carly2016 #nhpolitics http://t.co/dVjX32e9Tj
2015-08-19 19:33:48 +0000,"Common Core’s kind of standardization is always going to drive achievement down, not up. #Carly2016
https://t.co/BXzxEaXqwY"
2015-08-19 18:48:59 +0000,Excited to join North Country Republicans for the @NHGOP's Grassroots Training on 8/22! RSVP here: http://t.co/SscOvMaPaP #nhpolitics #fitn
2015-08-19 14:19:07 +0000,One of the reasons I'm a conservative is I don't believe the federal gov't should do everything it can do. #EDSummit15 #Carly2016
2015-08-19 14:10:23 +0000,Teachers' unions are a power structure designed to maintain the status quo for their own reasons. #EDSummit #Carly2016
2015-08-19 13:58:40 +0000,Common Core has become a set of standards based on what teachers have to teach. #EDSummit #Carly2016
2015-08-19 13:58:09 +0000,Federal government money is being used to pick winners and losers. #EDSummit15 #Carly2016
2015-08-19 13:57:46 +0000,What doesn't work are big bureaucratic programs in Washington. #EDSummit #Carly2016
2015-08-19 12:34:02 +0000,"Excited to speak at #EDSummit15 today in Londonderry, NH! You can watch live here: https://t.co/5eYeZMf8vB #Carly2016 @The74"
2015-08-18 23:09:02 +0000,I reviewed the TSA on @Yelp. One star. Stories of inept fed. bureaucracies have become far too common. #Carly2016 http://t.co/P2dB7IY2Dk
2015-08-18 17:06:48 +0000,Here’s my full #DMRSoapbox Q&amp;A. Join our team today to keep the momentum going. https://t.co/UsOPl0Vxnt https://t.co/QUxNzmNQLl #Carly2016
2015-08-18 14:49:44 +0000,"I am a conservative because I believe that no one of us is any better than any other one of us. #Carly2016
https://t.co/gdtF70aAHE"
2015-08-17 20:46:50 +0000,Glad I was able to visit the famous @ISF_ButterCow today. #Carly2016 #iacaucus @IowaStateFair http://t.co/WYYqKpsFkv
2015-08-17 20:45:26 +0000,It wouldn't be a trip to the @IowaStateFair without a trip to see the @IowaPorkFarmers. #Carly2016 #iacaucus http://t.co/TZtMygDF5w
2015-08-17 18:59:33 +0000,"There is no excuse. Planned Parenthood must be defunded. #Carly2016
https://t.co/DIWqnFe8T0"
2015-08-17 17:42:57 +0000,"Thank you, @IowaStateFair. #DMRSoapbox #Carly2016 http://t.co/0tPTBSgKBu"
2015-08-17 16:44:00 +0000,Taking the stage at #DMRSoapbox soon! Watch live here: http://t.co/h4aPNHqEpK #Carly2016 #iacaucus
2015-08-17 15:00:22 +0000,Speaking at #DMRSoapbox at 1:00 p.m. ET. You can watch live here: http://t.co/h4aPNHIfhi #Carly2016
2015-08-17 13:02:00 +0000,Here’s a recap of my speech last night to the Jewish Federation of Greater Des Moines: http://t.co/5Lh6hTuT4z #Carly2016 #iacaucus
2015-08-17 02:02:47 +0000,I enjoyed speaking to the Jewish Federation of Greater Des Moines this evening! #Carly2016 http://t.co/faaPwB8Le8
2015-08-16 00:17:40 +0000,Excited to join @ThisWeekABC tomorrow. Check local listings and tune in! #Carly2016 http://t.co/plg7eZLIRJ
2015-08-15 19:55:03 +0000,Good to be at Nevada Attorney General @AdamLaxalt's Inaugural Basque Fry! #Carly2016 http://t.co/pqE2S8mqD4
2015-08-15 18:18:41 +0000,Joining Dan Mason the air shortly Listen live on @NewsTalk780KOH in Reno or anywhere online at http://t.co/vPCvha5aex! #Carly2016
2015-08-14 23:05:03 +0000,I’m excited to join @greta shortly on @FoxNews. Tune in if you can! http://t.co/VUHR7rCOut #Carly2016
2015-08-14 21:07:55 +0000,"We need a leader that understands that their highest calling is to unlock the potential of this nation. #Carly2016
https://t.co/TRA14LaAtY"
2015-08-14 20:45:41 +0000,"We’re building momentum in Iowa and across the country. Join us today. https://t.co/UsOPl1d8f1 #Carly2016
https://t.co/dbV3GIR2Pt"
2015-08-14 20:15:09 +0000,Enjoyed talking with @JRubinBlogger about what we must to do to restore American leadership in the world. https://t.co/sPOBLr3Ore #Carly2016
2015-08-14 19:53:16 +0000,Good to be at Stellar Industries Garner this afternoon! #Carly2016 #iacaucus http://t.co/A5tYLL6CRt
2015-08-14 16:03:38 +0000,"Packed house at this morning's meet &amp; greet in Mason City, Iowa! #Carly2016 #iacaucus
https://t.co/RrRO35ifmr"
2015-08-14 13:50:05 +0000,I'm excited to talk with @amtalker shortly. You can listen here: http://t.co/CKDX4QCdVO #Carly2016 #iacaucus
2015-08-14 12:39:02 +0000,Now I'm getting ready to join @MariaBartiromo on @FoxBusiness. Watch here: http://t.co/VUHR7rCOut #Carly2016
2015-08-14 12:11:01 +0000,I'm coming up shortly on @foxandfriends. Tune in! http://t.co/VUHR7rUpT3 #Carly2016
2015-08-14 11:36:37 +0000,"I think people are looking for something and someone different. https://t.co/UsOPl1d8f1 #Carly2016
https://t.co/mj7vokRxf9"
2015-08-14 01:51:54 +0000,I'm joining @seanhannity around 10:30 p.m. ET. I hope you can tune in! http://t.co/VUHR7rUpT3 #Carly2016
2015-08-14 01:04:37 +0000,"Good to be in Alden, IA for this evening's townhall. Thanks to Bruce Rastetter for hosting! #Carly2016 http://t.co/qN6RWIhvUg"
2015-08-13 20:19:04 +0000,It's more than a little hypocritical for this fed. gov’t to dictate to small businesses how they should run. http://t.co/W4LXBp46LY
2015-08-13 20:17:03 +0000,"…37% less likely to promote them, and 45% more likely to fire them. http://t.co/W4LXBp46LY #Carly2016 (2/2)"
2015-08-13 20:16:06 +0000,"After such mandates were in place in Spain, companies were 6% less likely to hire women. http://t.co/W4LXBp46LY #Carly2016 (1/2)"
2015-08-13 20:15:05 +0000,"In other countries, these mandates have discouraged employers from hiring &amp; promoting women. http://t.co/W4LXBp46LY #Carly2016"
2015-08-13 20:14:06 +0000,The Left was instantly outraged I didn’t believe the fed. gov’t should require all companies to pay for leave. http://t.co/W4LXBp46LY
2015-08-13 20:12:04 +0000,"When I was at Hewlett-Packard, we offered paid maternity &amp; paternity leave. http://t.co/W4LXBp46LY #Carly2016"
2015-08-13 20:10:06 +0000,The political classes of both parties have failed women &amp; working families in this country. http://t.co/W4LXBp46LY #Carly2016
2015-08-13 17:40:57 +0000,Thanks for the support Team Carly. Spot on! - Staff http://t.co/mjBqBqaMID #Carly2016
2015-08-13 14:30:13 +0000,"We need a leader who understands executive decision-making, which is a tough call in a tough time with high stakes. http://t.co/liyhcmXmYx"
2015-08-13 14:15:05 +0000,We must not be afraid to call ISIS what it is: Islamic extremism. We must know what we’re up against to defeat it. http://t.co/liyhcmXmYx
2015-08-13 14:06:40 +0000,Thank you for the kind words @MonicaCrowley! http://t.co/liyhcmFM6Z #Carly2016
2015-08-13 13:27:56 +0000,.@HillaryClinton thinks she is entitled to your vote. I am working hard to earn it. http://t.co/sdMhriOBGy #Carly2016
2015-08-13 12:20:08 +0000,I'm looking forward to talking with @SimonRadio1776 shortly. You can listen live here: http://t.co/rbbXi3O9Ag #Carly2016
2015-08-12 21:46:43 +0000,"Chinese cyberattacks are an act of aggression on the U.S. and they must stop. https://t.co/UsOPl1d8f1 #Carly2016
https://t.co/a7GlPKmMQC"
2015-08-12 18:27:09 +0000,Enjoyed discussing the issues on @CBSNLive earlier today. You can watch the full interview here: http://t.co/Wd7ScPRDKm #Carly2016
2015-08-12 17:00:26 +0000,We’re gaining momentum across the country. Join our team today. https://t.co/UsOPl1d8f1 #Carly2016
2015-08-12 12:58:37 +0000,Catch my interview on @CBSNLive around 9:05 a.m. ET! http://t.co/mykw2N6Hui #Carly2016
2015-08-12 12:28:59 +0000,"What is necessary first and foremost is a different kind of leadership. https://t.co/UsOPl1d8f1 #Carly2016
https://t.co/KMBockEXWX"
2015-08-12 12:02:21 +0000,About to join @CBSThisMorning. Tune in! #Carly2016 http://t.co/OACxfgk0Tx
2015-08-12 11:30:17 +0000,I’m coming up shortly on @CBSThisMorning! http://t.co/Vj0swFANuI #Carly2016
2015-08-12 03:03:20 +0000,"If John Boehner and Mitch McConnell don't produce, they need to step aside. http://t.co/MghpY2XOZc #Carly2016"
2015-08-12 00:56:52 +0000,"On this issue, I don’t believe we should take any option off the table. http://t.co/MghpY2XOZc #Carly2016 #DefundPP"
2015-08-11 22:15:09 +0000,Excited to join @CBSThisMorning tomorrow. Tune in! http://t.co/Vj0swFANuI #Carly2016
2015-08-11 15:53:52 +0000,"Thank you @hughhewitt for letting me share my journey on last night’s show! #Carly2016
https://t.co/0ZImuKcaMT"
2015-08-10 21:52:59 +0000,My interview with @hughhewitt will be airing shortly around 6:00 p.m. ET. Tune in! http://t.co/R32YeoLo84 #Carly2016
